{
  "schemaVersion": "1.0",
  "offerId": "of_01k2m3n4p5q6r7s8t9v0w1x2a3",
  "intentId": "pi_01k2m3n4p5q6r7s8t9v0w1x2y3",
  "supplierToken": "sp_01k2m3n4p5q6r7s8t9v0w1x2b3",
  "version": 1,
  "status": "submitted",
  "price": {
    "subtotalMinor": 13500,
    "feesMinor": 2000,
    "taxMinor": 1400,
    "totalMinor": 16900,
    "currency": "USD"
  },
  "service": {
    "lotType": "garage",
    "shuttleMinutes": 5,
    "distanceMeters": 900,
    "availability": "limited_simulated",
    "addOns": ["indoor_walkway"]
  },
  "terms": {
    "cancellation": "free_until_48h",
    "refund": "original_method"
  },
  "validFrom": "2026-08-20T16:00:00Z",
  "validUntil": "2026-08-21T16:00:00Z",
  "evidence": [
    {
      "type": "supplier_policy",
      "ref": "policy.terminalflex.v2"
    }
  ],
  "simulation": true,
  "signature": "sg_01k2m3n4p5q6r7s8t9v0w1x2h3"
}
